{
  "current_week": 6,
  "games": [
    {
      "date": "2026-09-13",
      "matchup_id": 1,
      "rosterA": 9,
      "rosterB": 11,
      "round": "",
      "scoreA": 142.5,
      "scoreB": 176.06,
      "season": 2026,
      "status": "final",
      "teamA": "Joe",
      "teamB": "Kylie",
      "type": "Regular",
      "week": 1
    },
    {
      "date": "2026-09-13",
      "matchup_id": 2,
      "rosterA": 5,
      "rosterB": 7,
      "round": "",
      "scoreA": 139.92,
      "scoreB": 173.02,
      "season": 2026,
      "status": "final",
      "teamA": "Marian",
      "teamB": "Will",
      "type": "Regular",
      "week": 1
    },
    {
      "date": "2026-09-13",
      "matchup_id": 3,
      "rosterA": 3,
      "rosterB": 1,
      "round": "",
      "scoreA": 145.84,
      "scoreB": 100.66,
      "season": 2026,
      "status": "final",
      "teamA": "Taylor",
      "teamB": "Malcolm",
      "type": "Regular",
      "week": 1
    },
    {
      "date": "2026-09-13",
      "matchup_id": 4,
      "rosterA": 8,
      "rosterB": 6,
      "round": "",
      "scoreA": 138.5,
      "scoreB": 104.66,
      "season": 2026,
      "status": "final",
      "teamA": "Dulberger",
      "teamB": "Seth",
      "type": "Regular",
      "week": 1
    },
    {
      "date": "2026-09-13",
      "matchup_id": 5,
      "rosterA": 10,
      "rosterB": 2,
      "round": "",
      "scoreA": 127.46,
      "scoreB": 91.54,
      "season": 2026,
      "status": "final",
      "teamA": "Mino",
      "teamB": "Leah",
      "type": "Regular",
      "week": 1
    },
    {
      "date": "2026-09-13",
      "matchup_id": 6,
      "rosterA": 12,
      "rosterB": 4,
      "round": "",
      "scoreA": 126.76,
      "scoreB": 147.26,
      "season": 2026,
      "status": "final",
      "teamA": "Erin",
      "teamB": "Wei",
      "type": "Regular",
      "week": 1
    },
    {
      "date": "2026-09-20",
      "matchup_id": 7,
      "rosterA": 11,
      "rosterB": 7,
      "round": "",
      "scoreA": 121.42,
      "scoreB": 128.46,
      "season": 2026,
      "status": "final",
      "teamA": "Kylie",
      "teamB": "Will",
      "type": "Regular",
      "week": 2
    },
    {
      "date": "2026-09-20",
      "matchup_id": 8,
      "rosterA": 1,
      "rosterB": 9,
      "round": "",
      "scoreA": 113.44,
      "scoreB": 92.36,
      "season": 2026,
      "status": "final",
      "teamA": "Malcolm",
      "teamB": "Joe",
      "type": "Regular",
      "week": 2
    },
    {
      "date": "2026-09-20",
      "matchup_id": 9,
      "rosterA": 3,
      "rosterB": 5,
      "round": "",
      "scoreA": 177.88,
      "scoreB": 118.72,
      "season": 2026,
      "status": "final",
      "teamA": "Taylor",
      "teamB": "Marian",
      "type": "Regular",
      "week": 2
    },
    {
      "date": "2026-09-20",
      "matchup_id": 10,
      "rosterA": 6,
      "rosterB": 2,
      "round": "",
      "scoreA": 105.76,
      "scoreB": 120.82,
      "season": 2026,
      "status": "final",
      "teamA": "Seth",
      "teamB": "Leah",
      "type": "Regular",
      "week": 2
    },
    {
      "date": "2026-09-20",
      "matchup_id": 11,
      "rosterA": 4,
      "rosterB": 8,
      "round": "",
      "scoreA": 109.5,
      "scoreB": 194.18,
      "season": 2026,
      "status": "final",
      "teamA": "Wei",
      "teamB": "Dulberger",
      "type": "Regular",
      "week": 2
    },
    {
      "date": "2026-09-20",
      "matchup_id": 12,
      "rosterA": 12,
      "rosterB": 10,
      "round": "",
      "scoreA": 105.38,
      "scoreB": 50.62,
      "season": 2026,
      "status": "final",
      "teamA": "Erin",
      "teamB": "Mino",
      "type": "Regular",
      "week": 2
    },
    {
      "date": "2026-09-27",
      "matchup_id": 13,
      "rosterA": 1,
      "rosterB": 11,
      "round": "",
      "scoreA": 142.98,
      "scoreB": 94.16,
      "season": 2026,
      "status": "final",
      "teamA": "Malcolm",
      "teamB": "Kylie",
      "type": "Regular",
      "week": 3
    },
    {
      "date": "2026-09-27",
      "matchup_id": 14,
      "rosterA": 7,
      "rosterB": 3,
      "round": "",
      "scoreA": 142.22,
      "scoreB": 125.72,
      "season": 2026,
      "status": "final",
      "teamA": "Will",
      "teamB": "Taylor",
      "type": "Regular",
      "week": 3
    },
    {
      "date": "2026-09-27",
      "matchup_id": 15,
      "rosterA": 9,
      "rosterB": 5,
      "round": "",
      "scoreA": 154.18,
      "scoreB": 162.06,
      "season": 2026,
      "status": "final",
      "teamA": "Joe",
      "teamB": "Marian",
      "type": "Regular",
      "week": 3
    },
    {
      "date": "2026-09-27",
      "matchup_id": 16,
      "rosterA": 4,
      "rosterB": 6,
      "round": "",
      "scoreA": 133.94,
      "scoreB": 124.44,
      "season": 2026,
      "status": "final",
      "teamA": "Wei",
      "teamB": "Seth",
      "type": "Regular",
      "week": 3
    },
    {
      "date": "2026-09-27",
      "matchup_id": 17,
      "rosterA": 2,
      "rosterB": 12,
      "round": "",
      "scoreA": 156.94,
      "scoreB": 86.84,
      "season": 2026,
      "status": "final",
      "teamA": "Leah",
      "teamB": "Erin",
      "type": "Regular",
      "week": 3
    },
    {
      "date": "2026-09-27",
      "matchup_id": 18,
      "rosterA": 8,
      "rosterB": 10,
      "round": "",
      "scoreA": 116.44,
      "scoreB": 96.74,
      "season": 2026,
      "status": "final",
      "teamA": "Dulberger",
      "teamB": "Mino",
      "type": "Regular",
      "week": 3
    },
    {
      "date": "2026-09-30",
      "matchup_id": 19,
      "rosterA": 11,
      "rosterB": 3,
      "round": "",
      "scoreA": 125.32,
      "scoreB": 140.18,
      "season": 2026,
      "status": "final",
      "teamA": "Kylie",
      "teamB": "Taylor",
      "type": "Regular",
      "week": 4
    },
    {
      "date": "2026-09-30",
      "matchup_id": 20,
      "rosterA": 5,
      "rosterB": 1,
      "round": "",
      "scoreA": 143.26,
      "scoreB": 151.78,
      "season": 2026,
      "status": "final",
      "teamA": "Marian",
      "teamB": "Malcolm",
      "type": "Regular",
      "week": 4
    },
    {
      "date": "2026-09-30",
      "matchup_id": 21,
      "rosterA": 9,
      "rosterB": 7,
      "round": "",
      "scoreA": 127.68,
      "scoreB": 161.22,
      "season": 2026,
      "status": "final",
      "teamA": "Joe",
      "teamB": "Will",
      "type": "Regular",
      "week": 4
    },
    {
      "date": "2026-09-30",
      "matchup_id": 22,
      "rosterA": 6,
      "rosterB": 12,
      "round": "",
      "scoreA": 142.92,
      "scoreB": 108.06,
      "season": 2026,
      "status": "final",
      "teamA": "Seth",
      "teamB": "Erin",
      "type": "Regular",
      "week": 4
    },
    {
      "date": "2026-09-30",
      "matchup_id": 23,
      "rosterA": 10,
      "rosterB": 4,
      "round": "",
      "scoreA": 129.06,
      "scoreB": 133.48,
      "season": 2026,
      "status": "final",
      "teamA": "Mino",
      "teamB": "Wei",
      "type": "Regular",
      "week": 4
    },
    {
      "date": "2026-09-30",
      "matchup_id": 24,
      "rosterA": 8,
      "rosterB": 2,
      "round": "",
      "scoreA": 91.4,
      "scoreB": 83.06,
      "season": 2026,
      "status": "final",
      "teamA": "Dulberger",
      "teamB": "Leah",
      "type": "Regular",
      "week": 4
    },
    {
      "date": "2026-10-07",
      "matchup_id": 25,
      "rosterA": 5,
      "rosterB": 11,
      "round": "",
      "scoreA": 158.26,
      "scoreB": 148.6,
      "season": 2026,
      "status": "final",
      "teamA": "Marian",
      "teamB": "Kylie",
      "type": "Regular",
      "week": 5
    },
    {
      "date": "2026-10-07",
      "matchup_id": 26,
      "rosterA": 3,
      "rosterB": 9,
      "round": "",
      "scoreA": 151.94,
      "scoreB": 161.42,
      "season": 2026,
      "status": "final",
      "teamA": "Taylor",
      "teamB": "Joe",
      "type": "Regular",
      "week": 5
    },
    {
      "date": "2026-10-07",
      "matchup_id": 27,
      "rosterA": 1,
      "rosterB": 7,
      "round": "",
      "scoreA": 126.46,
      "scoreB": 120.3,
      "season": 2026,
      "status": "final",
      "teamA": "Malcolm",
      "teamB": "Will",
      "type": "Regular",
      "week": 5
    },
    {
      "date": "2026-10-07",
      "matchup_id": 28,
      "rosterA": 10,
      "rosterB": 6,
      "round": "",
      "scoreA": 151.68,
      "scoreB": 92.7,
      "season": 2026,
      "status": "final",
      "teamA": "Mino",
      "teamB": "Seth",
      "type": "Regular",
      "week": 5
    },
    {
      "date": "2026-10-07",
      "matchup_id": 29,
      "rosterA": 12,
      "rosterB": 8,
      "round": "",
      "scoreA": 92.8,
      "scoreB": 131.22,
      "season": 2026,
      "status": "final",
      "teamA": "Erin",
      "teamB": "Dulberger",
      "type": "Regular",
      "week": 5
    },
    {
      "date": "2026-10-07",
      "matchup_id": 30,
      "rosterA": 4,
      "rosterB": 2,
      "round": "",
      "scoreA": 104.9,
      "scoreB": 174.82,
      "season": 2026,
      "status": "final",
      "teamA": "Wei",
      "teamB": "Leah",
      "type": "Regular",
      "week": 5
    },
    {
      "date": "2026-10-14",
      "matchup_id": 31,
      "rosterA": 11,
      "rosterB": 6,
      "round": "",
      "scoreA": null,
      "scoreB": null,
      "season": 2026,
      "status": "scheduled",
      "teamA": "Kylie",
      "teamB": "Seth",
      "type": "Regular",
      "week": 6
    },
    {
      "date": "2026-10-14",
      "matchup_id": 32,
      "rosterA": 9,
      "rosterB": 8,
      "round": "",
      "scoreA": null,
      "scoreB": null,
      "season": 2026,
      "status": "scheduled",
      "teamA": "Joe",
      "teamB": "Dulberger",
      "type": "Regular",
      "week": 6
    },
    {
      "date": "2026-10-14",
      "matchup_id": 33,
      "rosterA": 7,
      "rosterB": 2,
      "round": "",